[
  {
    "schema": "census.structural-card.v1",
    "oracle_id": "00000000-0000-4000-8000-000000000001",
    "source_card_id": "00000000-0000-4000-8000-000000000011",
    "source_record_sha256": "1111111111111111111111111111111111111111111111111111111111111111",
    "name": "Golden Exact",
    "layout": "normal",
    "mana_cost": null,
    "type_line": "Sorcery",
    "oracle_text": "Draw two cards.",
    "colors": null,
    "color_identity": null,
    "color_indicator": null,
    "keywords": null,
    "produced_mana": null,
    "power": null,
    "toughness": null,
    "loyalty": null,
    "defense": null,
    "hand_modifier": null,
    "life_modifier": null,
    "attraction_lights": null,
    "faces": null,
    "all_parts": null
  },
  {
    "schema": "census.structural-card.v1",
    "oracle_id": "11111111-1111-4111-8111-111111111111",
    "source_card_id": "11111111-1111-4111-8111-111111111112",
    "source_record_sha256": "2222222222222222222222222222222222222222222222222222222222222222",
    "name": "Golden Double",
    "layout": "normal",
    "mana_cost": null,
    "type_line": "Sorcery",
    "oracle_text": "Draw two cards. Draw one card.",
    "colors": null,
    "color_identity": null,
    "color_indicator": null,
    "keywords": null,
    "produced_mana": null,
    "power": null,
    "toughness": null,
    "loyalty": null,
    "defense": null,
    "hand_modifier": null,
    "life_modifier": null,
    "attraction_lights": null,
    "faces": null,
    "all_parts": null
  },
  {
    "schema": "census.structural-card.v1",
    "oracle_id": "22222222-2222-4222-8222-222222222222",
    "source_card_id": "22222222-2222-4222-8222-222222222223",
    "source_record_sha256": "3333333333333333333333333333333333333333333333333333333333333333",
    "name": "Golden Faces",
    "layout": "modal_dfc",
    "mana_cost": null,
    "type_line": null,
    "oracle_text": null,
    "colors": null,
    "color_identity": null,
    "color_indicator": null,
    "keywords": null,
    "produced_mana": null,
    "power": null,
    "toughness": null,
    "loyalty": null,
    "defense": null,
    "hand_modifier": null,
    "life_modifier": null,
    "attraction_lights": null,
    "faces": [
      {
        "face_index": 0,
        "name": "Golden Front",
        "mana_cost": null,
        "type_line": "Sorcery",
        "oracle_text": "Draw two cards.",
        "colors": null,
        "color_indicator": null,
        "power": null,
        "toughness": null,
        "loyalty": null,
        "defense": null
      },
      {
        "face_index": 1,
        "name": "Golden Back",
        "mana_cost": null,
        "type_line": "Sorcery",
        "oracle_text": "Draw one card.",
        "colors": null,
        "color_indicator": null,
        "power": null,
        "toughness": null,
        "loyalty": null,
        "defense": null
      }
    ],
    "all_parts": null
  },
  {
    "schema": "census.structural-card.v1",
    "oracle_id": "33333333-3333-4333-8333-333333333333",
    "source_card_id": "33333333-3333-4333-8333-333333333334",
    "source_record_sha256": "4444444444444444444444444444444444444444444444444444444444444444",
    "name": "Golden Unsupported",
    "layout": "normal",
    "mana_cost": null,
    "type_line": "Sorcery",
    "oracle_text": "Choose an unsupported shape.",
    "colors": null,
    "color_identity": null,
    "color_indicator": null,
    "keywords": null,
    "produced_mana": null,
    "power": null,
    "toughness": null,
    "loyalty": null,
    "defense": null,
    "hand_modifier": null,
    "life_modifier": null,
    "attraction_lights": null,
    "faces": null,
    "all_parts": null
  },
  {
    "schema": "census.structural-card.v1",
    "oracle_id": "44444444-4444-4444-8444-444444444444",
    "source_card_id": "44444444-4444-4444-8444-444444444445",
    "source_record_sha256": "5555555555555555555555555555555555555555555555555555555555555555",
    "name": "Golden No Match",
    "layout": "normal",
    "mana_cost": null,
    "type_line": "Sorcery",
    "oracle_text": "No matching rule.",
    "colors": null,
    "color_identity": null,
    "color_indicator": null,
    "keywords": null,
    "produced_mana": null,
    "power": null,
    "toughness": null,
    "loyalty": null,
    "defense": null,
    "hand_modifier": null,
    "life_modifier": null,
    "attraction_lights": null,
    "faces": null,
    "all_parts": null
  }
]
